{"messageType":"query_result","schemaVersion":"1.0","requestId":"9425e5e2-ab5a-4cf1-b602-a3c0a8329fb1","workspaceId":"ae3ed580-0e0e-45d2-8742-113a4a137d9e","operation":"get_mod_element_editor","status":"succeeded","revision":1,"data":{"element":{"id":"01d05905-8832-436d-8032-2dce3fa569bb","type":"item","name":"sample_item","displayName":"Sample Item","state":"valid","ownership":"generated","updatedAt":"2026-10-12T19:01:09.853913100Z","firstParty":true,"diagnostics":{"error":0,"warning":0,"info":0},"identity":{"internalName":"sample_item","registryName":"sample_item","source":"generator_definition","namespace":"editor_contract","resourceId":"editor_contract:sample_item"}},"sections":[{"id":"general","title":{"key":"editor.section.general","fallback":"General","args":{}},"fields":[{"path":"/displayName","label":{"key":"field.display_name","fallback":"DisplayName","args":{}},"control":"text","required":false,"readOnly":false,"value":"Sample Item","options":[],"diagnostics":[]},{"path":"/name","label":{"key":"field.name","fallback":"Name","args":{}},"control":"text","required":false,"readOnly":true,"value":"sample_item","options":[],"diagnostics":[]},{"path":"/description","label":{"key":"field.description","fallback":"Description","args":{}},"control":"textarea","required":false,"readOnly":false,"value":"","options":[],"diagnostics":[]},{"path":"/texture","label":{"key":"field.texture","fallback":"Texture","args":{}},"control":"select","required":false,"readOnly":false,"value":"minecraft:barrier","options":[{"value":"minecraft:barrier","label":{"key":"field.option","fallback":"minecraft:barrier","args":{"label":"minecraft:barrier"}},"disabled":false,"reason":null},{"value":"minecraft:coal","label":{"key":"field.option","fallback":"minecraft:coal","args":{"label":"minecraft:coal"}},"disabled":false,"reason":null},{"value":"minecraft:paper","label":{"key":"field.option","fallback":"minecraft:paper","args":{"label":"minecraft:paper"}},"disabled":false,"reason":null},{"value":"minecraft:stick","label":{"key":"field.option","fallback":"minecraft:stick","args":{"label":"minecraft:stick"}},"disabled":false,"reason":null}],"diagnostics":[]},{"path":"/rarity","label":{"key":"field.rarity","fallback":"Rarity","args":{}},"control":"select","required":false,"readOnly":false,"value":"COMMON","options":[{"value":"COMMON","label":{"key":"field.option","fallback":"COMMON","args":{"label":"COMMON"}},"disabled":false,"reason":null},{"value":"UNCOMMON","label":{"key":"field.option","fallback":"UNCOMMON","args":{"label":"UNCOMMON"}},"disabled":false,"reason":null},{"value":"RARE","label":{"key":"field.option","fallback":"RARE","args":{"label":"RARE"}},"disabled":false,"reason":null},{"value":"EPIC","label":{"key":"field.option","fallback":"EPIC","args":{"label":"EPIC"}},"disabled":false,"reason":null}],"diagnostics":[]},{"path":"/stackSize","label":{"key":"field.stack_size","fallback":"StackSize","args":{}},"control":"number","required":false,"readOnly":false,"value":64,"options":[],"constraints":{"min":1.0,"max":99.0,"step":1.0},"diagnostics":[]},{"path":"/immuneToFire","label":{"key":"field.immune_to_fire","fallback":"ImmuneToFire","args":{}},"control":"toggle","required":false,"readOnly":false,"value":false,"options":[],"diagnostics":[]},{"path":"/fuelBurnTime","label":{"key":"field.fuel_burn_time","fallback":"FuelBurnTime","args":{}},"control":"number","required":false,"readOnly":false,"value":0,"options":[],"constraints":{"min":0.0,"max":128000.0,"step":1.0},"diagnostics":[]},{"path":"/compostingLayers","label":{"key":"field.composting_layers","fallback":"CompostingLayers","args":{}},"control":"number","required":false,"readOnly":false,"value":0,"options":[],"constraints":{"min":0.0,"max":7.0,"step":1.0},"diagnostics":[]}]}],"capabilities":[{"id":"mod_elements.create","availability":"unavailable","reasonCode":"PREVIEW_NEGOTIATION_REQUIRED","message":{"key":"diagnostic.preview_negotiation_required","fallback":"Use negotiated preview capabilities for this target.","args":{}},"affectedPaths":[]},{"id":"workspace.build","availability":"unavailable","reasonCode":"PREVIEW_NEGOTIATION_REQUIRED","message":{"key":"diagnostic.preview_negotiation_required","fallback":"Use negotiated preview capabilities for this target.","args":{}},"affectedPaths":[]},{"id":"workspace.migrate_loader","availability":"unavailable","reasonCode":"PREVIEW_NEGOTIATION_REQUIRED","message":{"key":"diagnostic.preview_negotiation_required","fallback":"Use negotiated preview capabilities for this target.","args":{}},"affectedPaths":[]},{"id":"workspace.import_upstream","availability":"unavailable","reasonCode":"PREVIEW_NEGOTIATION_REQUIRED","message":{"key":"diagnostic.preview_negotiation_required","fallback":"Use negotiated preview capabilities for this target.","args":{}},"affectedPaths":[]},{"id":"assets.publish_batch","availability":"unavailable","reasonCode":"PREVIEW_NEGOTIATION_REQUIRED","message":{"key":"diagnostic.preview_negotiation_required","fallback":"Use negotiated preview capabilities for this target.","args":{}},"affectedPaths":[]}]},"diagnostics":[]}