{"messageType":"query_result","schemaVersion":"1.0","requestId":"465353bf-a9e9-46a8-a4d6-4824433cd4f6","workspaceId":"ae3ed580-0e0e-45d2-8742-113a4a137d9e","operation":"get_mod_element_editor","status":"succeeded","revision":5,"data":{"element":{"id":"de268e0e-2482-4169-8c22-b687661e262d","type":"code","name":"sample_code","displayName":"Sample Code","state":"valid","ownership":"manual","updatedAt":"2026-10-12T19:01:10.282103600Z","firstParty":true,"diagnostics":{"error":0,"warning":0,"info":0},"identity":{"internalName":"sample_code","registryName":"sample_code","source":"generator_definition"}},"sections":[{"id":"identity","title":{"key":"editor.section.identity","fallback":"Identity","args":{}},"fields":[{"path":"/displayName","label":{"key":"field.display_name","fallback":"DisplayName","args":{}},"control":"text","required":false,"readOnly":false,"value":"Sample Code","options":[],"diagnostics":[]},{"path":"/name","label":{"key":"field.name","fallback":"Name","args":{}},"control":"text","required":false,"readOnly":true,"value":"sample_code","options":[],"diagnostics":[]},{"path":"/description","label":{"key":"field.description","fallback":"Description","args":{}},"control":"textarea","required":false,"readOnly":false,"value":"","options":[],"diagnostics":[]}]},{"id":"behavior","title":{"key":"editor.section.behavior","fallback":"Behavior","args":{}},"fields":[{"path":"/code","label":{"key":"field.code","fallback":"Code","args":{}},"control":"textarea","required":false,"readOnly":false,"value":"","options":[],"diagnostics":[]},{"path":"/codeFiles","label":{"key":"field.code_files","fallback":"CodeFiles","args":{}},"control":"json","required":false,"readOnly":false,"value":[],"options":[],"diagnostics":[]},{"path":"/sourceFingerprints/$primary","label":{"key":"field._primary","fallback":"$primary","args":{}},"control":"text","required":false,"readOnly":true,"value":"e3b0c44298fc1c149afbf4c8996fb92427ae41e4649b934ca495991b7852b855","options":[],"diagnostics":[]}]}],"capabilities":[{"id":"mod_elements.create","availability":"unavailable","reasonCode":"PREVIEW_NEGOTIATION_REQUIRED","message":{"key":"diagnostic.preview_negotiation_required","fallback":"Use negotiated preview capabilities for this target.","args":{}},"affectedPaths":[]},{"id":"workspace.build","availability":"unavailable","reasonCode":"PREVIEW_NEGOTIATION_REQUIRED","message":{"key":"diagnostic.preview_negotiation_required","fallback":"Use negotiated preview capabilities for this target.","args":{}},"affectedPaths":[]},{"id":"workspace.migrate_loader","availability":"unavailable","reasonCode":"PREVIEW_NEGOTIATION_REQUIRED","message":{"key":"diagnostic.preview_negotiation_required","fallback":"Use negotiated preview capabilities for this target.","args":{}},"affectedPaths":[]},{"id":"workspace.import_upstream","availability":"unavailable","reasonCode":"PREVIEW_NEGOTIATION_REQUIRED","message":{"key":"diagnostic.preview_negotiation_required","fallback":"Use negotiated preview capabilities for this target.","args":{}},"affectedPaths":[]},{"id":"assets.publish_batch","availability":"unavailable","reasonCode":"PREVIEW_NEGOTIATION_REQUIRED","message":{"key":"diagnostic.preview_negotiation_required","fallback":"Use negotiated preview capabilities for this target.","args":{}},"affectedPaths":[]}]},"diagnostics":[]}